{
  "$schema": "https://json-schema.org/draft/2020-12/schema",
  "$id": "urn:epick:w3-c01:0.2-candidate:index-request",
  "$defs": {
    "Document": {
      "additionalProperties": false,
      "properties": {
        "document_id": {
          "pattern": "^[0-9a-fA-F]{8}-[0-9a-fA-F]{4}-[0-9a-fA-F]{4}-[0-9a-fA-F]{4}-[0-9a-fA-F]{12}$",
          "title": "Document Id",
          "type": "string"
        },
        "evidence_id": {
          "pattern": "^[0-9a-fA-F]{8}-[0-9a-fA-F]{4}-[0-9a-fA-F]{4}-[0-9a-fA-F]{4}-[0-9a-fA-F]{12}$",
          "title": "Evidence Id",
          "type": "string"
        },
        "text": {
          "maxLength": 100000,
          "minLength": 1,
          "title": "Text",
          "type": "string"
        }
      },
      "required": [
        "document_id",
        "evidence_id",
        "text"
      ],
      "title": "Document",
      "type": "object"
    },
    "IndexKey": {
      "additionalProperties": false,
      "properties": {
        "source_version_id": {
          "pattern": "^[0-9a-fA-F]{8}-[0-9a-fA-F]{4}-[0-9a-fA-F]{4}-[0-9a-fA-F]{4}-[0-9a-fA-F]{12}$",
          "title": "Source Version Id",
          "type": "string"
        },
        "extraction_revision_id": {
          "pattern": "^[0-9a-fA-F]{8}-[0-9a-fA-F]{4}-[0-9a-fA-F]{4}-[0-9a-fA-F]{4}-[0-9a-fA-F]{12}$",
          "title": "Extraction Revision Id",
          "type": "string"
        },
        "representation": {
          "minLength": 1,
          "title": "Representation",
          "type": "string"
        },
        "normalization_version": {
          "minLength": 1,
          "title": "Normalization Version",
          "type": "string"
        }
      },
      "required": [
        "source_version_id",
        "extraction_revision_id",
        "representation",
        "normalization_version"
      ],
      "title": "IndexKey",
      "type": "object"
    }
  },
  "additionalProperties": false,
  "properties": {
    "schema_version": {
      "const": "w3-c01/0.2-candidate",
      "title": "Schema Version",
      "type": "string"
    },
    "source_id": {
      "pattern": "^[0-9a-fA-F]{8}-[0-9a-fA-F]{4}-[0-9a-fA-F]{4}-[0-9a-fA-F]{4}-[0-9a-fA-F]{12}$",
      "title": "Source Id",
      "type": "string"
    },
    "event_cursor": {
      "maximum": 9223372036854775807,
      "minimum": 0,
      "title": "Event Cursor",
      "type": "integer"
    },
    "restriction_revision": {
      "maximum": 9223372036854775807,
      "minimum": 0,
      "title": "Restriction Revision",
      "type": "integer"
    },
    "index_key": {
      "$ref": "#/$defs/IndexKey"
    },
    "retention_scope": {
      "const": "excerpts_only",
      "title": "Retention Scope",
      "type": "string"
    },
    "expires_at": {
      "pattern": "^\\d{4}-\\d{2}-\\d{2}T\\d{2}:\\d{2}:\\d{2}Z$",
      "title": "Expires At",
      "type": "string"
    },
    "documents": {
      "items": {
        "$ref": "#/$defs/Document"
      },
      "maxItems": 100,
      "minItems": 1,
      "title": "Documents",
      "type": "array"
    }
  },
  "required": [
    "schema_version",
    "source_id",
    "event_cursor",
    "restriction_revision",
    "index_key",
    "retention_scope",
    "expires_at",
    "documents"
  ],
  "title": "IndexRequest",
  "type": "object"
}
